document_number,title,admin unit,type,publication_date,comments_close_on,comment_url,html_url,docket_ids,days_left,lon,lat
2025-14846,"Malheur, Umatilla, and Wallowa-Whitman National Forests; Oregon and Washington; Revision of the Land Management Plans",Malheur National Forest; Umatilla National Forest; Wallowa-Whitman National Forest, Notice,2025-08-05,2025-10-06,,https://www.federalregister.gov/documents/2025/08/05/2025-14846/malheur-umatilla-and-wallowa-whitman-national-forests-oregon-and-washington-revision-of-the-land,[],60.0,,
2025-14832,Information Collection: Forest Products Removal Permits and Contracts,Notice,2025-08-05,2025-10-06,http://www.regulations.gov/commenton/FS_FRDOC_0001-4110,https://www.federalregister.gov/documents/2025/08/05/2025-14832/information-collection-forest-products-removal-permits-and-contracts,[],60,,,
2025-13252,Dixie National Forest; Utah; Brian Head Resort Expansion Environmental Impact Statement,Dixie National Forest,Notice,2025-07-15,2025-08-29,,https://www.federalregister.gov/documents/2025/07/15/2025-13252/dixie-national-forest-utah-brian-head-resort-expansion-environmental-impact-statement,[],22.0,-112.60017263002877,37.70332477107805
2025-11827,Information Collection; Pesticide-Use Proposal.,Notice,2025-06-26,2025-08-25,http://www.regulations.gov/commenton/FS_FRDOC_0001-4099,https://www.federalregister.gov/documents/2025/06/26/2025-11827/information-collection-pesticide-use-proposal,[],18,,,
2025-11759,Information Collection; Community Forest and Open Space Conservation Program,Notice,2025-06-26,2025-08-25,http://www.regulations.gov/commenton/FS_FRDOC_0001-4098,https://www.federalregister.gov/documents/2025/06/26/2025-11759/information-collection-community-forest-and-open-space-conservation-program,[],18,,,
2025-11538,Information Collection; Information Collection Clearance for the Stewardship Mapping and Assessment Project (STEW-MAP),Notice,2025-06-24,2025-08-25,http://www.regulations.gov/commenton/FS_FRDOC_0001-4097,https://www.federalregister.gov/documents/2025/06/24/2025-11538/information-collection-information-collection-clearance-for-the-stewardship-mapping-and-assessment,[],18,,,
